Title,Price
,
Winter men's sheepskin thickening warm gloves,$49.90 to $53.90
"Miller Lite Winter Hat OSFA, Miller Products, Stocking Nordic Pom Winter Hat",$12.99
Mens Autumn And Winter Christmas Products Hooded Sweatshirt Holiday Special,$22.83 to $25.46
Official Product of The U.S Navy Unisex beanie Sport Winter Fleece Camo OS,$26.23
VINTAGE Stihl Hat Adult Chainsaw K-Products Snapback Mesh Trucker Cap Patch Logo,$5.50
Jeep Hat cap osfm adjustable American Legend official Product,$14.99
NICE! Case IH Magnum Tractors 7200 Series Hat Strap-back Cap K-Products USA,$10.00
Men Cool Mix Wool Military Special Force Army French Artist Hat Cap Beret,$12.71 to $16.95
Buyers Products Company Black Hat Beanie Stocking cap SnowDogg Winter Snow cap,$7.99
NYPD Beanie Knit Hat / Official Product,$15.99
K-Products Brand Headgear Castle Fireball Fuel injector Hat Cap Strapback Black,$17.50
Kubota Tractor Hat Black White Thread K-Products Baseball Hat Cap Strapback NEW,$9.99
Snap Back cap Select Sire power inc. All red trucker hat k-products,$25.00
"Argentina AFA Winter Jacket 2021 - Adidas Official Product (M, L, XL)",$409.00
ESPN gray knit winter hat by K-Products,$35.99
Winter's Warmth Columbia Special Products 2LP CSP-315/316 (SEALED),$10.59
D-BASF Chemical Company Adjustable Black and Camo Flame Cap Hat by K-Products,$14.99
"DAISY BRAND MEAT PRODUCTS CHICAGO, IL USA Trucker SnapBack Hat w/red Ball Vntg",$45.93
New Ramones Embroidered Presidential Seal Snapback Trucker Hat badhabitmerch,$23.00
Sun Products Black Cross Embellished New Orleans Unisex Adult One Size Hat Cap,$26.99
Illuminati All Seeing Psychic Eye Embroidered Cuff Beanie,$27.95
Vintage Pacific Steel & Recycling Denim Trucker Hat Cap Snapback K-Products USA,$21.99
US ARMY WARRIOR GENERAL DOUGLAS MAC ARTHUR KHAKI UNIFORM HAT ALL SIZES CP MADE,$130.00
REALTREE LOGO BROWN SUEDE CURVED CAMO BILL ADJUSTABLE HAT CAP OUTDOOR HUNTING,$11.95
Winter Knitted Pom Slouchy Baggy Beanie Hat Fur lined Thermal Striped Ski Cap,$9.99 to $19.99
Umbro Williams Racing Beanie NEW Formula One F1 Team Hat Navy Licensed Product,$11.44
Everton Cuff Bobble Knitted Hat Sign Gift New Official Licensed Football Product,$19.17
VINTAGE Broadstrike DowElanco Earflaps FARM Hat Cap K Products 6 7/8-7 1/8,$20.99
Winter Hand For Women's Portability Tips For Daily Use Hand Protection Products,$0.99
VTG USA TODAY Logo The Nation's Newspaper Black Snapback Hat K Products SAMPLE,$97.77
Winter Plush Blankets Soft Warm Fluffy 2 Ply Thicken Faux Fur Plaid Blankets,$313.47 to $376.18
Vintage Goodyear Trucker Cap Mesh Blue Snapback K-Products USA Spellout Patch,$39.97
New Scottish Tam O' Shanter Hat Various Tartan Cap / Tammy Cap One Size,$12.77 to $15.33
OSPREYS Beanie NEW Rugby Team Hat Black Licensed Product Union Wales,$11.44
VINTAGE Dairy Queen Hat White Trucker Cap Strap Back K Products 80s Made in USA,$34.99
VTG Cincy Cap Snapback Hat OSFM Bickers Metal Products Ohio Pinstripe Retro 90s,$14.97
John Deere Ten Series Maximizer Combines Hat Snapback Farm K-Products Cap NOS,$10.90
LUCAS OIL MARINE PRODUCTS Face mask Face Cover Homemade,$4.00
Winter Supplies Mini Heating Blanket Sofa Pad Heating Pad Warming Products,$21.98 to $39.97
Unisex Winter Beanie Hat Knitted Pom-pom Fur lined Thermal Striped Snow Ski Cap,$9.99 to $19.99
"Gray and Black Distressed IH Logo Hat, IHSGB",$28.99
Zurich Insurance Tan Baseball Cap Strapback Cap K-Products,$12.00
Case IH International Harvester K-Products Adjustable Hat Cap Men Black Silver,$11.99
Lone Star Studios Strapback Hat Cap Embroidered Movie Film TV Studio Texas Vtg,$16.99
2022 Mororock Rib-Knit Acrylic Beanie Winter Lightweight Cuff Unisex Man women,$7.99 to $9.99
LP70010 John Deere Licensed Green Owners Edition Cap / Hat,$7.99
Paramount Pictures Hat Cap Strap Back White Logo Adult OS Adjustable Film Movie,$9.58
Carpe Noctem Seize The Night Vampire Embroidered Baseball Cap Dad hat,$29.95
Official Licensed Product WWE John Cena Knitted Hat Junior New,$12.77
Ariat Western Products Rafter C- Trucker Mesh Adjustable Snap Back Cap Hat,$10.95
Starfleet United Federation of Planets Embroidered Baseball Cap Dad hat,$29.95
Camo Bush Giggle Bucket Hat Army Style Woodland Camouflage Poly/Cotton,$17.09
Psychobilly Horror Psycho Embroidered Cuff Beanie Science Fiction Drip,$27.95
Iron Cross Occult Symbol World War II Style Embroidered Baseball Cap Dad hat,$29.95
Inverted Pentagram Occult Symbol Embroidered Cuff Beanie Evil,$27.95
Snap Back cap Select Sire power inc. All bright orange trucker hat k-products,$25.00
Predator Alien Hybrid Embroidered Baseball Cap Predalien Creature Dad hat,$29.95
Pentacross Inverted Pentagram Cross Embroidered Baseball Cap Satanic Dad hat,$29.95
Home Slippers Winter Warm Soft Shoes Superhero Superman Unisex Slipper Gift,$24.28
Olympics USA Hat Cap Strap Back Mens Adjustable Blue K-Products,$9.49
